"ID","Type","Name","Documentation"
"VS1","ValueStream","Create Foundational Knowledge Assets","End-to-end stream to generate, validate, and publish new scholarly knowledge for reuse and societal impact."
"VS1.1","ValueStream","Formulate Research Question","Define a clear, impactful, and testable research question grounded in evidence and gaps."
"VS1.2","ValueStream","Design Study","Plan methodology, protocols, instruments, and compliance to answer the research question."
"VS1.3","ValueStream","Acquire Data","Collect or source data ethically and reliably according to the study design."
"VS1.4","ValueStream","Analyze Data","Process, model, and interpret data to generate defensible findings."
"VS1.5","ValueStream","Author and Submit Manuscript","Draft, format, and submit manuscripts to appropriate venues."
"VS1.6","ValueStream","Peer Review and Revise","Address reviewer feedback and refine content to meet publication standards."
"VS1.7","ValueStream","Publish and Disseminate","Publish outputs and disseminate through repositories and channels for broad access."
"VS2","ValueStream","Design Academic Programs & Courses","Stream to architect, validate, and maintain programs and courses ready for delivery."
"VS2.1","ValueStream","Define Program Outcomes","Specify measurable learning outcomes aligned to competencies and market needs."
"VS2.2","ValueStream","Architect Curriculum","Structure courses, sequences, and credits to achieve program outcomes."
"VS2.3","ValueStream","Develop Course Materials","Author and assemble syllabi, content, assessments, and teaching guides."
"VS2.4","ValueStream","Validate and Approve Program","Secure governance, accreditation, and quality approvals for launch."
"VS2.5","ValueStream","Refresh and Sunset Content","Continuously update, version, and retire content to ensure currency."
"VS3","ValueStream","Deliver Personalized Learning Journeys","Stream to attract, educate, assess, and credential learners with tailored experiences."
"VS3.1","ValueStream","Attract and Advise Learner","Engage prospects and guide pathway choices based on goals and readiness."
"VS3.2","ValueStream","Admit and Enroll Learner","Process applications, decisions, registration, and onboarding."
"VS3.3","ValueStream","Deliver Instruction","Facilitate teaching and learning interactions across modalities."
"VS3.4","ValueStream","Assess Learning","Evaluate knowledge, skills, and competencies with valid measures."
"VS3.5","ValueStream","Credential and Graduate","Confirm requirements, confer credentials, and record attainment."
"VS3.6","ValueStream","Place and Engage Alumni","Support career placement and sustain alumni relationships and contributions."
"VS4","ValueStream","Conduct Sponsored Research Engagements","Stream to win, execute, and close sponsored projects delivering agreed outcomes."
"VS4.1","ValueStream","Identify Opportunity","Scan and qualify sponsor needs and alignment opportunities."
"VS4.2","ValueStream","Shape and Submit Proposal","Develop scope, budget, and plan; submit compliant proposals."
"VS4.3","ValueStream","Negotiate Scope and Terms","Finalize scope, IP, compliance, and commercial terms with sponsors."
"VS4.4","ValueStream","Execute Project","Manage tasks, resources, and risks to deliver project scope."
"VS4.5","ValueStream","Deliver Results and IP","Provide deliverables, data, and IP per contractual obligations."
"VS4.6","ValueStream","Closeout and Report","Complete financial, compliance, and technical closeout reporting."
"VS5","ValueStream","Commercialize Research Outputs","Stream to translate research into licenses or ventures that reach markets."
"VS5.1","ValueStream","Scout and Disclose Inventions","Identify innovations and submit formal disclosures."
"VS5.2","ValueStream","Protect Intellectual Property","Secure IP through filings and prosecution strategies."
"VS5.3","ValueStream","Evaluate Market Potential","Assess market size, fit, and commercialization pathways."
"VS5.4","ValueStream","Execute Licensing or Venture Formation","Negotiate licenses or form startups to commercialize IP."
"VS5.5","ValueStream","Support Venture/IP Scale-Up","Enable growth with mentoring, funding access, and partnerships."
"CAP1","Capability","Knowledge Asset Creation","Organizational ability to produce, validate, and publish scholarly knowledge assets."
"CAP1.1","Capability","Research Question Formulation","Capability to identify gaps and craft testable, impactful research questions."
"CAP1.2","Capability","Study Protocol Design","Capability to design rigorous, compliant research protocols and instruments."
"CAP1.3","Capability","Research Data Acquisition","Capability to obtain high-quality, ethical, and reliable research data."
"CAP1.4","Capability","Data Analysis","Capability to analyze data and derive valid insights and conclusions."
"CAP1.5","Capability","Manuscript Authoring","Capability to author, format, and submit scholarly manuscripts."
"CAP1.6","Capability","Peer Review Response","Capability to manage reviews, revise content, and resubmit effectively."
"CAP1.7","Capability","Publication & Repository Deposit","Capability to publish outputs and deposit artifacts in repositories."
"CAP2","Capability","Academic Program Engineering","Ability to design, govern, and sustain academic programs and courses."
"CAP2.1","Capability","Program Outcome Definition","Capability to define measurable, accredited-aligned learning outcomes."
"CAP2.2","Capability","Curriculum Architecture","Capability to structure curricula, sequences, credits, and prerequisites."
"CAP2.3","Capability","Course Material Authoring","Capability to create high-quality instructional materials and assessments."
"CAP2.4","Capability","Program Validation & Approval","Capability to achieve internal and external approvals and accreditation."
"CAP2.5","Capability","Content Refresh & Sunsetting","Capability to update and retire content through controlled lifecycle."
"CAP3","Capability","Learning Experience Delivery","Ability to attract, enroll, teach, assess, and graduate learners."
"CAP3.1","Capability","Learner Advising","Capability to counsel learners on pathways and supports."
"CAP3.2","Capability","Admission & Enrollment Processing","Capability to process applications, decisions, registration, and onboarding."
"CAP3.3","Capability","Instruction Facilitation","Capability to deliver effective teaching across modalities."
"CAP3.4","Capability","Assessment Administration","Capability to design, deliver, and grade assessments with integrity."
"CAP3.5","Capability","Credential Issuance","Capability to verify completion and issue official credentials."
"CAP3.6","Capability","Alumni Engagement & Placement","Capability to support placement and maintain alumni relationships."
"CAP4","Capability","Sponsored Research Delivery","Ability to acquire, execute, and close sponsored research projects."
"CAP4.1","Capability","Opportunity Identification","Capability to discover and qualify sponsor-aligned opportunities."
"CAP4.2","Capability","Proposal Development","Capability to plan, budget, and submit competitive proposals."
"CAP4.3","Capability","Scope & Terms Negotiation","Capability to negotiate scope, IP, and commercial terms."
"CAP4.4","Capability","Sponsored Research Execution","Capability to manage delivery, risks, and compliance for projects."
"CAP4.5","Capability","Results & IP Delivery","Capability to produce deliverables, data, and IP per agreements."
"CAP4.6","Capability","Project Closeout","Capability to complete financial, compliance, and technical closeout."
"CAP5","Capability","Innovation & IP Translation","Ability to protect, license, and scale research-derived innovations."
"CAP5.1","Capability","Invention Scouting & Disclosure","Capability to identify innovations and file formal disclosures."
"CAP5.2","Capability","Patent Filing & Prosecution","Capability to secure IP through patent strategy and actions."
"CAP5.3","Capability","Market Potential Evaluation","Capability to assess market attractiveness and commercialization routes."
"CAP5.4","Capability","Licensing Execution","Capability to structure and negotiate licensing agreements."
"CAP5.5","Capability","Venture Scale-Up Support","Capability to enable startup growth via resources and networks."
"OBJ1","BusinessObject","Knowledge Asset","Published scholarly artifact or dataset intended for reuse and citation."
"OBJ1.1","BusinessObject","Research Question","Statement of the problem or hypothesis under investigation."
"OBJ1.2","BusinessObject","Study Protocol","Documented methodology, procedures, and instruments for research."
"OBJ1.3","BusinessObject","Research Data","Collected data sets produced or sourced during the study."
"OBJ1.4","BusinessObject","Analytical Results","Derived results, models, or findings from data analysis."
"OBJ1.5","BusinessObject","Manuscript","Authored scholarly paper prepared for submission or publication."
"OBJ1.6","BusinessObject","Revision Package","Compiled responses and changes addressing peer review."
"OBJ1.7","BusinessObject","Published Output","Final published article, dataset, or repository record."
"OBJ2","BusinessObject","Academic Program Asset","Definition artifacts that specify and govern academic offerings."
"OBJ2.1","BusinessObject","Program Outcomes","Target competencies and achievements for graduates."
"OBJ2.2","BusinessObject","Curriculum Blueprint","Structured plan of courses, sequences, and credit design."
"OBJ2.3","BusinessObject","Course Materials","Instructional content, assessments, and teaching guides."
"OBJ2.4","BusinessObject","Program Validation Package","Evidence and documentation for program approval."
"OBJ2.5","BusinessObject","Content Lifecycle Plan","Plan for versioning, updates, and retirement of materials."
"OBJ3","BusinessObject","Learning Delivery Record","Artifacts documenting learner engagement and achievement."
"OBJ3.1","BusinessObject","Advising Plan","Personalized academic plan and guidance notes."
"OBJ3.2","BusinessObject","Enrollment Record","Official record of admissions, registration, and status."
"OBJ3.3","BusinessObject","Delivered Instruction Session","Record of instructional sessions delivered to learners."
"OBJ3.4","BusinessObject","Assessment Attempt","Submission and results for a specific assessment instance."
"OBJ3.5","BusinessObject","Credential","Official recognition of completed learning and attainment."
"OBJ3.6","BusinessObject","Alumni Engagement Profile","Ongoing profile of alumni activities and outcomes."
"OBJ4","BusinessObject","Sponsored Research Engagement Artifact","Contractual and technical records of sponsored projects."
"OBJ4.1","BusinessObject","Opportunity Brief","Summary of sponsor needs and research opportunity fit."
"OBJ4.2","BusinessObject","Proposal","Formal offer detailing scope, budget, and approach."
"OBJ4.3","BusinessObject","Research Agreement","Executed contract setting terms, IP, and obligations."
"OBJ4.4","BusinessObject","Sponsored Research Output","Results, prototypes, or datasets produced in the project."
"OBJ4.5","BusinessObject","Sponsor Deliverable","Contracted deliverables supplied to the sponsor."
"OBJ4.6","BusinessObject","Closeout Package","Final technical, financial, and compliance documentation."
"OBJ5","BusinessObject","Innovation & Commercialization Artifact","Artifacts used to protect, license, and grow innovations."
"OBJ5.1","BusinessObject","Invention Disclosure","Filed description of a new invention or discovery."
"OBJ5.2","BusinessObject","Patent Application","Application filed to obtain legal IP protection."
"OBJ5.3","BusinessObject","Market Evaluation Report","Analysis of market size, demand, and competitive landscape."
"OBJ5.4","BusinessObject","License Agreement","Contract granting rights to use IP under defined terms."
"OBJ5.5","BusinessObject","Venture Scale-Up Plan","Plan outlining growth milestones, resources, and risks."
